<?xml version='1.0' encoding="UTF-8"?>
<!ELEMENT age  (#PCDATA)>
<!ELEMENT email  (#PCDATA)>
<!ELEMENT gender   (#PCDATA)>
<!ELEMENT id  (#PCDATA)>
<!ELEMENT name  (#PCDATA)>
<!ELEMENT java  (#PCDATA)>
<!ELEMENT student (id,name,age,gender,email,java)>
<!ELEMENT students  (student+)>
